[
    {
        "description": "minProperties validation",
        "specification": [
            {
                "validation": "6.5.2"
            }
        ],
        "schema": {
            "$schema": "https://json-schema.org/draft/2020-12/schema",
            "minProperties": 1
        },
        "tests": [
            {
                "description": "longer is valid",
                "data": {"foo": 1, "bar": 2},
                "valid": true
            },
            {
                "description": "exact length is valid",
                "data": {"foo": 1},
                "valid": true
            },
            {
                "description": "too short is invalid",
                "data": {},
                "valid": false
            },
            {
                "description": "ignores arrays",
                "data": [],
                "valid": true
            },
            {
                "description": "ignores strings",
                "data": "",
                "valid": true
            },
            {
                "description": "ignores other non-objects",
                "data": 12,
                "valid": true
            },
            {
                "description": "ignores null",
                "data": null,
                "valid": true
            },
            {
                "description": "ignores booleans",
                "data": true,
                "valid": true
            }
        ]
    },
    {
        "description": "minProperties validation with a decimal",
        "specification": [
            {
                "validation": "6.5.2"
            }
        ],
        "schema": {
            "$schema": "https://json-schema.org/draft/2020-12/schema",
            "minProperties": 1.0
        },
        "tests": [
            {
                "description": "longer is valid",
                "data": {"foo": 1, "bar": 2},
                "valid": true
            },
            {
                "description": "too short is invalid",
                "data": {},
                "valid": false
            }
        ]
    }
]
