[
    {
        "description": "minLength validation",
        "specification": [
            {
                "validation": "6.3.2"
            }
        ],
        "schema": {"minLength": 2},
        "tests": [
            {
                "description": "longer is valid",
                "data": "foo",
                "valid": true
            },
            {
                "description": "exact length is valid",
                "data": "fo",
                "valid": true
            },
            {
                "description": "too short is invalid",
                "data": "f",
                "valid": false
            },
            {
                "description": "ignores non-strings",
                "data": 1,
                "valid": true
            },
            {
                "description": "one grapheme is not long enough",
                "data": "\uD83D\uDCA9",
                "valid": false
            }
        ]
    },
    {
        "description": "minLength validation with a decimal",
        "specification": [
            {
                "validation": "6.3.2"
            }
        ],
        "schema": {"minLength": 2.0},
        "tests": [
            {
                "description": "longer is valid",
                "data": "foo",
                "valid": true
            },
            {
                "description": "too short is invalid",
                "data": "f",
                "valid": false
            }
        ]
    }
]
